{
  "schemaVersion": 1,
  "origin": "fixture",
  "asOf": 1789902000500,
  "captureStartedAt": 1789902000000,
  "epoch": 0,
  "sequence": 0,
  "coverage": "starting",
  "coverageReasons": ["capture-initializing"],
  "capabilities": { "observe": true, "block": false, "terminate": false, "permissions": true },
  "droppedEvents": null,
  "truncated": false,
  "apps": [],
  "interfaces": []
}
