{
  "schemaVersion": 1,
  "origin": "fixture",
  "asOf": 1789905600000,
  "captureStartedAt": 1789902000000,
  "epoch": 0,
  "sequence": 91,
  "coverage": "disconnected",
  "coverageReasons": ["host-unreachable"],
  "capabilities": { "observe": false, "block": false, "terminate": false, "permissions": false },
  "droppedEvents": null,
  "truncated": false,
  "apps": [],
  "interfaces": []
}
